issue,filename,title,authors
Issue 1 - 2026-Feb,1 Liao Yuanyu.pdf,Untrammeled Landscape Painting and the Loyalist Mentality: Style and Implication of Yun Shouping’s Scroll of Mount Lingyan,"Liao Yuanyu, Qiu Yiwen"
Issue 1 - 2026-Feb,2 Lv Dan.pdf,From the Development of Future Drama to the Emergence of Theatrical Ethics,Lv Dan
Issue 1 - 2026-Feb,3 Sheng Tong.pdf,The Conception of “Post-Classicism” in Art,Sheng Tong
Issue 1 - 2026-Feb,4 Sun Tangshui.pdf,"Community-Based Voluntary Elderly Care Services: From Fragmentation to Integration, A Case Study of Three Community Centers in N City, China",Sun Tangshui
Issue 1 - 2026-Feb,5 Scott Tighe.pdf,The Effects of Globalization and Internationalization on Higher Education in the United States,"Scott Tighe, Dogoldogol Bridget S."
